ten sach,ten tac gia,gia sach,so luong da ban,so luong binh luan,danh gia trung binh,anh sach
MBA bằng hình (Trọn gói hai năm kiến thức quản trị kinh doanh qua trực quan sinh động),"JASON BARRON, MBA",160890,16,0,0.0,https://salt.tikicdn.com/cache/280x280/ts/product/3e/25/3a/1e6bc9998b75b3345a4c38dd93bbbe16.jpg
Sách Nghĩ Giàu Và Làm Giàu (Bìa Mềm),NAPOLEON HILL,77100,13752,1793,5.0,https://salt.tikicdn.com/cache/280x280/ts/product/99/10/67/aa71f851071fc05bec537bec76dc4234.jpg
Sách Người Giàu Có Nhất Thành Babylon (Tái Bản 2020),GEORGE SAMUEL CLASON,45100,17373,2490,5.0,https://salt.tikicdn.com/cache/280x280/ts/product/23/f8/75/5e90d6e0eabaebd068c815cf1c1f7396.jpg
Siêu Cò – How To Be A Power Connector,JUDY ROBINETT,249000,13573,2242,4.8,https://salt.tikicdn.com/cache/280x280/ts/product/ee/82/04/d75cdcedc89262a81aa1125b92146658.jpg
Bí Mật Của Phan Thiên Ân,ALAN PHAN,69000,25722,2425,4.8,https://salt.tikicdn.com/cache/280x280/ts/product/68/54/9d/0be45a6ee47f6dd8ae8d55222378541d.jpg
MBA bằng hình (Trọn gói hai năm kiến thức quản trị kinh doanh qua trực quan sinh động),"JASON BARRON, MBA",146000,3420,180,5.0,https://salt.tikicdn.com/cache/280x280/ts/product/3e/25/3a/1e6bc9998b75b3345a4c38dd93bbbe16.jpg
Sách Người Giàu Có Nhất Thành Babylon (Tái Bản 2020),GEORGE SAMUEL CLASON,45100,17373,2490,5.0,https://salt.tikicdn.com/cache/280x280/ts/product/23/f8/75/5e90d6e0eabaebd068c815cf1c1f7396.jpg
Sách Nghĩ Giàu Và Làm Giàu (Bìa Mềm),NAPOLEON HILL,77100,13752,1793,5.0,https://salt.tikicdn.com/cache/280x280/ts/product/99/10/67/aa71f851071fc05bec537bec76dc4234.jpg
Tư Duy Nhanh Và Chậm (Tái Bản),DANIEL KAHNEMAN,191000,2166,148,4.7,https://salt.tikicdn.com/cache/280x280/ts/product/61/76/af/539c898761023d4113cfbea439cb22d7.jpg
Search Inside Yourself – Tìm kiếm bên trong bạn (Tái bản),CHADE-MENG TAN,112000,1805,84,4.7,https://salt.tikicdn.com/cache/280x280/ts/product/7e/90/12/c0a91ec408287e64e03611cc430f1318.jpg
Khi Khách Hàng Lên Tiếng,JANELLE BARLOW,64900,994,36,4.5,https://salt.tikicdn.com/cache/280x280/media/catalog/producttmp/5b/40/b1/945ee598536a33c676ce7944a985fd9a.jpg
Hiểu Hết Về Kinh Doanh,DK,288840,227,32,4.8,https://salt.tikicdn.com/cache/280x280/ts/product/2b/51/65/6d4bbd638d7adca9d725b5f86a19f52f.jpg
Thấu Hiểu Tiếp Thị Từ A Đến Z - 80 Khái Niệm Nhà Quản Lý Cần Biết (Tái Bản 2020),PHILIP KOTLER,98330,160,15,4.7,https://salt.tikicdn.com/cache/280x280/ts/product/6f/5a/85/65d47d0459440296c5697f24ceca54ae.jpg
Biến Mọi Thứ Thành Tiền - Make Money - Nguyễn Anh Dũng,NGUYỄN ANH DŨNG,89000,359,37,4.3,https://salt.tikicdn.com/cache/280x280/ts/product/f8/70/2e/a0f65c6588dcaebd37706300f32e5d42.jpg
Sách Combo 4 Cuốn : Nghĩ Giàu Làm Giàu - Người Giàu Có Nhất Thành Babylon - Biến Mọi Thứ Thành Tiền Quyển 1+2 - SBOOKS,NHIEU TAC GIA,274000,10,0,0.0,https://salt.tikicdn.com/cache/280x280/ts/product/7e/6d/86/91323f8320b260f9ee1b0c32563352b3.jpeg
Không Bao Giờ Là Thất Bại - Tất Cả Là Thử Thách (Ấn Bản Cập Nhật Đầy Đủ Nhất)(Bìa Cứng),CHUNG JU YUNG,104000,9793,749,5.0,https://salt.tikicdn.com/cache/280x280/ts/product/b9/bb/cf/b9c3cb0e86596f31e2bd7ab37174a226.jpg
Bộ Sách Kinh Doanh Chuỗi Cửa Hàng - Bí Quyết Xây Dựng Chuỗi Bán Lẻ - Chuỗi Cafe Nhà Hàng Thành Công,N/A,380000,248,15,5.0,https://salt.tikicdn.com/cache/280x280/ts/product/73/75/7b/42a0feee8dce1abb2f0120cf1bf6adb4.png
1 thắng 9 bại - Câu chuyện khởi nghiệp và gây dựng thương hiệu của ông chủ UNIQLO - tỷ phú giàu nhất Nhật Bản,TADASHI YANAI,98500,79,2,5.0,https://salt.tikicdn.com/cache/280x280/ts/product/f7/8a/99/b6a6153ea65ce176a2da968953b45d67.jpg
Tiền Không Mua Được Gì (What money can't buy?) - Michael Sandel Tác giả Phải Trái Đúng Sai,MICHAEL SANDEL,96300,1925,179,5.0,https://salt.tikicdn.com/cache/280x280/ts/product/9a/b0/b7/01ad3bce3de50eaca4087bd15515aa5e.jpg
Lời Thú Tội Mới Của Một Sát Thủ Kinh Tế,JOHN PERKINS,172000,4735,511,4.7,https://salt.tikicdn.com/cache/280x280/ts/product/ce/0d/94/0b0ac1bf197c8e5724eb69438ff6be18.jpg
Sách - Người Giàu Có Nhất Thành Babylon (George Samuel Clason) - Tái Bản Mới Nhất 2023 - Sbooks,GEORGE SAMUEL CLASON,69000,296,7,5.0,https://salt.tikicdn.com/cache/280x280/ts/product/0d/fc/9e/e4bcc47f57fd71319fa9694bb708065d.png
"Cất Cánh Trên Sàn Thương Mại Điện Tử - Tôi đã xây dựng JulyHouse, Macaland và Loli & The Wolf như thế nào?",N/A,169000,669,22,5.0,https://salt.tikicdn.com/cache/280x280/ts/product/1b/e3/9a/b257a1d94196c60849751f6d0b4d6459.png
NGƯỜI GIÀU NHẤT THẾ GIỚI,N/A,79000,517,50,4.7,https://salt.tikicdn.com/cache/280x280/ts/product/64/aa/92/0545fda2f9fa2e1defdc47ff4fdf1159.png
Hàn Quốc Quốc Gia Gây Sững Sờ,DANIEL TUDOR,180000,261,26,4.8,https://salt.tikicdn.com/cache/280x280/ts/product/17/b8/43/0543673510a79e492b53759ae06b2701.jpg
Sách Dám Làm Giàu (Tái Bản 2020),PHẠM TUẤN SƠN,68500,901,113,4.8,https://salt.tikicdn.com/cache/280x280/ts/product/98/20/d0/894673e90fee6d948cb48fe209461cc7.jpg
Bí Mật Của Phan Thiên Ân,ALAN PHAN,69000,25722,2425,4.8,https://salt.tikicdn.com/cache/280x280/ts/product/68/54/9d/0be45a6ee47f6dd8ae8d55222378541d.jpg
Quản Trị Chiến Lược Thực Chiến,TRẦN QUỐC VIỆT,253000,45,0,0.0,https://salt.tikicdn.com/cache/280x280/ts/product/5c/26/df/0f516a05b8e4ace4649b5a995bc04dc5.jpg
Dạy Con Làm Giàu (Tập 1) - Để Không Có Tiền Vẫn Tạo Ra Tiền - Cha Giàu Cha Nghèo (Tái Bản),ROBERT T. KIYOSAKI,60100,37768,3551,4.8,https://salt.tikicdn.com/cache/280x280/ts/product/17/02/d1/52dde080f00d414a2d441c544c76d9c9.jpg
Siêu Cò – How To Be A Power Connector,JUDY ROBINETT,249000,13573,2242,4.8,https://salt.tikicdn.com/cache/280x280/ts/product/ee/82/04/d75cdcedc89262a81aa1125b92146658.jpg
Quản Lý Nghiệp (Tái Bản),"GESHE MICHAEL ROACH, LAMA CHRISTIE MCNALLY, MICHAEL GORDON",44300,2980,145,5.0,https://salt.tikicdn.com/cache/280x280/ts/product/73/7c/38/f19544c19f96261d24873bb909fd342f.jpg
Kinh Doanh Ẩm Thực Đường Phố - Bài Học Thực Chiến Từ Thành Công Của Thương Hiệu Bánh Mì Má Hải,N/A,152000,137,8,4.6,https://salt.tikicdn.com/cache/280x280/ts/product/10/2f/bc/badddb970ac0e7b2c23859d28dc2652c.png
Sách Dám Làm Giàu (Tái Bản 2020),PHẠM TUẤN SƠN,68500,901,113,4.8,https://salt.tikicdn.com/cache/280x280/ts/product/98/20/d0/894673e90fee6d948cb48fe209461cc7.jpg
Trên Đỉnh Phố Wall (Tái bản 2021),"JOHN ROTHCHILD, PETER LYNCH",164000,913,114,5.0,https://salt.tikicdn.com/cache/280x280/ts/product/bb/54/13/36f0440c22aa64a3bf8c9db4e789c187.jpg
Chiến Lược Chuyển Đổi Số,DAVID L. ROGERS,169600,60,2,5.0,https://salt.tikicdn.com/cache/280x280/ts/product/6a/03/f9/8aaa31d5cebad31de7e9ba68d8c160ac.png
Thấu Hiểu Tiếp Thị Từ A Đến Z - 80 Khái Niệm Nhà Quản Lý Cần Biết (Tái Bản 2020),PHILIP KOTLER,86300,8663,929,4.8,https://salt.tikicdn.com/cache/280x280/ts/product/cc/19/36/6205270d5e39c36c0b53eafdda916db1.jpeg
Luật Bố già - Bài học kinh doanh từ những ông trùm Mafia,LOUIS FERRANTE,97500,1824,236,4.8,https://salt.tikicdn.com/cache/280x280/ts/product/d4/3b/37/a28e22d1f373e9deda3430a7c10e029e.jpg
Lộ Trình Chuyển Đổi Số Doanh Nghiệp,DAVID L. ROGERS,198400,90,4,5.0,https://salt.tikicdn.com/cache/280x280/ts/product/49/3e/32/fb247124bcfb19226c0abdc144446a1d.png
Đừng Để Mất Bò - 7 Bước Quản Lý Cửa Hàng Hiệu Quả Và Chống Thất Thoát,TRẦN THANH PHONG,149000,5239,737,5.0,https://salt.tikicdn.com/cache/280x280/ts/product/d8/8c/1b/6077dd3c1b7fe51de9f2bba4b401d349.png
Triết Lý Kinh Doanh Của Kyocera,INAMORI KAZUO,132000,1822,158,4.8,https://salt.tikicdn.com/cache/280x280/ts/product/ca/ac/4c/ef79f9f202258eac99d663b7b1c2e672.jpg
Dạy Con Làm Giàu - Tập 3: Hướng Dẫn Đầu Tư,ROBERT T. KIYOSAKI,152000,3846,633,5.0,https://salt.tikicdn.com/cache/280x280/ts/product/49/80/11/c2f6d588cf17b89d1de2d11af4b71533.jpg
Câu Trả Lời Của Người Chiến Thắng,"JACK WELCH, SUZY WELCH",59500,375,24,4.6,https://salt.tikicdn.com/cache/280x280/ts/product/20/41/ec/f83753c81a431b5f4de98c9ba7abf64d.jpg
Hàn Quốc Quốc Gia Gây Sững Sờ,DANIEL TUDOR,180000,261,26,4.8,https://salt.tikicdn.com/cache/280x280/ts/product/17/b8/43/0543673510a79e492b53759ae06b2701.jpg
Khám Phá Ngành Kinh Doanh Dịch Vụ,LEONARD L.BERRY,144000,94,10,4.5,https://salt.tikicdn.com/cache/280x280/ts/product/06/b2/1a/9462d3e24c1d69f007652b8c220a5700.jpg
Chiến Lược Đầu Tư Chứng Khoán + Cổ Phiếu Thường Lợi Nhuận Phi Thường,N/A,309500,15,3,4.7,https://salt.tikicdn.com/cache/280x280/ts/product/af/b5/25/94f4f1b71215b037ea5acce5e60c2ca0.jpg
"Combo 2 Cuốn ""Hiểu Hết"" : How Business Works - Hiểu Hết Về Kinh Doanh + How Money Works - Hiểu Hết Về Tiền",DK,473000,1385,196,4.8,https://salt.tikicdn.com/cache/280x280/ts/product/1c/f6/61/72d2c1e03edfb4858614f88f5fb2b7df.jpg
Sách Nghĩ Giàu và Làm Giàu (Bìa Cứng) (Tái Bản 2020),NAPOLEON HILL,118000,2411,383,4.8,https://salt.tikicdn.com/cache/280x280/ts/product/5f/91/c8/2133fdc8ae25ff72de54a8f775b8f051.jpg
Dạy Con Làm Giàu (Tập 2) - Sử Dụng Đồng Vốn,ROBERT T. KIYOSAKI,117000,10521,1450,5.0,https://salt.tikicdn.com/cache/280x280/ts/product/ee/a0/9d/75ba4783ab39a9af5fb3f2e4bc0e16af.jpg
Nhân Tố Quyết Định Nên Người Thành Đạt - Khám Phá Các Giá Trị Và Năng Lực Cốt Lõi Của Bạn (TS. BS. Nguyễn Thành Nhơn),N/A,159000,26,0,0.0,https://salt.tikicdn.com/cache/280x280/ts/product/44/d6/94/4a0615575a984715d05685aa9326f117.png
Kinh Tế Học Hài Hước (Tái Bản),"STEVEN D. LEVITT, STEPHEN J. DUBNER",122000,1252,121,4.6,https://salt.tikicdn.com/cache/280x280/ts/product/4d/07/f8/b7f31766abebfb62e596db1a4b68c9b3.jpg
Nghĩ Giàu Và Làm Giàu (Khổ Nhỏ),NAPOLEON HILL,75700,2378,357,4.7,https://salt.tikicdn.com/cache/280x280/ts/product/29/9f/a0/0e867c16e3826d230e2aa4795d6a14c0.jpg
Combo Dạy Con Làm Giàu (Trọn Bộ 13 Tập) (Tái Bản 2022),NHIỀU TÁC GIẢ,1175000,835,72,5.0,https://salt.tikicdn.com/cache/280x280/ts/product/9e/6d/bf/b145dbecca1a04e9200fb5c1595364cc.jpg
Hiểu Hết Về Kinh Doanh,DK,280000,5885,810,4.7,https://salt.tikicdn.com/cache/280x280/ts/product/2b/51/65/6d4bbd638d7adca9d725b5f86a19f52f.jpg
Tôi Đã Làm Giàu Như Thế Đấy,J. PAUL GETTY,79600,193,18,4.5,https://salt.tikicdn.com/cache/280x280/ts/product/43/e0/f7/22ac0973fe5975d9cce60193bb730faa.jpg
Hiểu Nghèo Thoát Nghèo (Tái Bản),"ABHIJIT V. BANERJEE, ESTHER DUFLO",120000,1609,157,4.8,https://salt.tikicdn.com/cache/280x280/ts/product/62/f4/3f/4fb114436443c313647e3589998bac46.jpg
Phương Pháp Đầu Tư Warren Buffett,ROBERT G. HAGSTROM,109000,615,79,4.8,https://salt.tikicdn.com/cache/280x280/ts/product/e1/4f/22/41812bda7bd5227c17fbef63ef2a4743.JPG
