ten sach,ten tac gia,gia sach,so luong da ban,so luong binh luan,danh gia trung binh,anh sach
"Người Bình Thường Không Ai Khởi Nghiệp - Nghe Chuyện Thành Bại, Cho Chủ Mới Bớt Chơi Vơi!",N/A,167000,371,14,5.0,https://salt.tikicdn.com/cache/280x280/ts/product/c2/77/70/49698947ff22eb75d8cf464ed531f57c.png
9 Lần Khởi Nghiệp - Chuyện Kể Về Những Thất Bại Và Thành Công Của Một Triệu Phú,NGUYỄN PHƯƠNG NAM,149000,3127,343,5.0,https://salt.tikicdn.com/cache/280x280/ts/product/06/f2/a6/ee0891089d257986454a543bb51d9f4d.png
Giải Mã Hành Vi Disc: Bạn Thuộc Kiểu Lãnh Đạo Nào Trong 8 Nhóm Hành Vi?,"JEFFREY SUGERMAN, MARK SCULLARD, EMMA WILHELM",85000,143,9,5.0,https://salt.tikicdn.com/cache/280x280/ts/product/6b/01/3f/bb642a8047cb5f5cc4c0e872892389d4.jpg
Tâm Thư Của Warren Buffett Dành Cho Con Cái,N/A,137240,196,8,5.0,https://salt.tikicdn.com/cache/280x280/ts/product/20/e4/fb/dd47aa254b4a57faefe94c5c1f0eb5f6.jpg
Góc Nhìn Alan - Dành Tặng Doanh Nhân Việt Trong Thế Trận Toàn Cầu,ALAN PHAN,199000,1199,127,4.8,https://salt.tikicdn.com/cache/280x280/ts/product/e0/d6/36/29ef581680b81198a2c02f69a83e7c1d.jpg
"Người Bình Thường Không Ai Khởi Nghiệp - Nghe Chuyện Thành Bại, Cho Chủ Mới Bớt Chơi Vơi!",N/A,167000,371,14,5.0,https://salt.tikicdn.com/cache/280x280/ts/product/c2/77/70/49698947ff22eb75d8cf464ed531f57c.png
Những Kẻ Xuất Chúng (Tái Bản),MALCOLM GLADWELL,115000,789,56,4.7,https://salt.tikicdn.com/cache/280x280/ts/product/29/15/97/f535cd564d0fd8131efcae2ac921f782.jpg
Triết Lý Đầu Tư Của Warren Buffett (Warren Buffett – Inside the Ultimate Money Mind) - Robert G. Hagstrom - PACE Books,ROBERT G HAGSTROM,171600,10,2,5.0,https://salt.tikicdn.com/cache/280x280/ts/product/9a/97/74/70cfd86154b668606edbb148698eb2bc.png
Những Chân Lý Đơn Giản Về Lãnh Đạo (Simple Truths of Leadership) - Ken Blanchard và Randy Conley - PACE Books,KEN BLANCHARD,94300,N/A,0,0.0,https://salt.tikicdn.com/cache/280x280/ts/product/ab/a1/d8/ff564b9459085721bfe4b674e14a4ad3.png
Chạm Tay Hóa Vàng (Tái Bản),DONALD J.TRUMP,86100,3288,324,5.0,https://salt.tikicdn.com/cache/280x280/ts/product/3b/d9/53/4424d53171bd422bf9990dda6c81fafb.jpg
Triết Lý Đầu Tư Của Warren Buffett (Warren Buffett – Inside the Ultimate Money Mind) - Robert G. Hagstrom - PACE Books,ROBERT G HAGSTROM,150000,1,0,0.0,https://salt.tikicdn.com/cache/280x280/ts/product/9a/97/74/70cfd86154b668606edbb148698eb2bc.png
Góc Nhìn Alan - Bộ Di Sản Alan Phan,ALAN PHAN,516000,2192,248,4.8,https://salt.tikicdn.com/cache/280x280/ts/product/19/d6/e2/6dc445e282f3f316072cd7f7808e2227.jpg
Chết Vì Chứng Khoán,RICHARDS,143280,389,74,5.0,https://salt.tikicdn.com/cache/280x280/ts/product/06/12/f8/fe9ebb72776d7735e45fc19950e05338.png
Bản Lĩnh CTO: Kế Hoạch 100 Ngày Trở Thành Giám Đốc Công Nghệ Xuất Sắc,N/A,117640,110,1,4.0,https://salt.tikicdn.com/cache/280x280/ts/product/ff/0a/84/5ffc5eccfee2ee75a3f2731742ab2df6.jpg
Combo 5 Cuốn: Bộ Công Cụ Xây Dựng Đo Lường Toàn Bộ Các Chỉ Số Của Doanh Nghiệp,NHÓM TÁC GIẢ,416650,27,5,5.0,https://salt.tikicdn.com/cache/280x280/ts/product/e0/33/24/1508eab82cbaa8cd942db58c6e8fa847.jpg
Giải Mã Hành Vi Disc: Bạn Thuộc Kiểu Lãnh Đạo Nào Trong 8 Nhóm Hành Vi?,"JEFFREY SUGERMAN, MARK SCULLARD, EMMA WILHELM",102100,699,61,4.8,https://salt.tikicdn.com/cache/280x280/ts/product/10/68/03/7504e0c88b360331487d7c2c0c68c93d.jpg
9 Lần Khởi Nghiệp - Chuyện Kể Về Những Thất Bại Và Thành Công Của Một Triệu Phú,NGUYỄN PHƯƠNG NAM,149000,3127,343,5.0,https://salt.tikicdn.com/cache/280x280/ts/product/06/f2/a6/ee0891089d257986454a543bb51d9f4d.png
Warren Buffett - Quá Trình Hình Thành Một Nhà Tư Bản Mỹ (Tái Bản),ROGER LOWENSTEIN,205000,525,87,4.7,https://salt.tikicdn.com/cache/280x280/ts/product/5b/6b/2d/fb3ef883e8c8350c46e818a56025960a.jpg
Khác Biệt Để Vươn Tầm - Hành Trình Khởi Nghiệp Của Mai Quốc Bình - CEO Thế Giới Giấy - Thay Đổi Và Hành Động Để Vươn Tầm,MAI QUỐC BÌNH,252000,725,55,5.0,https://salt.tikicdn.com/cache/280x280/ts/product/fc/7e/e9/9c4e193f4f9ec1644b912e09945e0e82.png
Gã nghiện giày - Tự truyện của nhà sáng lập Nike,PHIL KNIGHT,161000,187,18,4.6,https://salt.tikicdn.com/cache/280x280/ts/product/33/fd/f2/5dcf6cac2a845e962e11d0beb15901ca.jpg
Phương Pháp Quản Trị Mục Tiêu – Triết Lý Kinh Doanh Của Công Ty Tỷ Đô BYTEDANCE,N/A,137240,36,0,0.0,https://salt.tikicdn.com/cache/280x280/ts/product/8f/54/ef/bc5882713b138815003aa4c7b3981609.jpg
Sách Hành Trình Xây Dựng Thương Hiệu Cá Nhân,N/A,122640,69,3,5.0,https://salt.tikicdn.com/cache/280x280/ts/product/1b/08/24/1585d0d04cdec44737cee2c084193e23.jpg
5 Nguyên Tắc Bất Biến Để Xây Dựng Đội Nhóm Vô Địch,N/A,140160,55,0,0.0,https://salt.tikicdn.com/cache/280x280/ts/product/eb/76/dc/a39ce7f1eff6020779bb7f9743df12c2.jpg
Doanh Nghiệp Của Thế Kỷ 21 (Tái Bản 2023),N/A,86000,26,1,5.0,https://salt.tikicdn.com/cache/280x280/ts/product/3d/b0/de/57620d00460eb71408c6e03dd91fdd2b.jpeg
Nhà Quản Lý Cấp Trung: Mắt Xích Sống Còn Của Doanh Nghiệp,N/A,144540,90,2,5.0,https://salt.tikicdn.com/cache/280x280/ts/product/20/d4/fe/28694d01d5f096ff9011d5ab79db9545.jpg
How Brands Grow - Con Đường Tăng Trưởng Thương Hiệu (Những Sự Thật Về Tiếp Thị Chưa Từng Được Khám Phá),BYRON SHARP,181000,65,1,5.0,https://salt.tikicdn.com/cache/280x280/ts/product/f0/4d/bb/e8a0572c9f8d02d63427cbf70e545846.jpg
D.Trump - Tôi Đã Làm Giàu Như Thế,DONALD J. TRUMP,82800,3834,324,4.8,https://salt.tikicdn.com/cache/280x280/ts/product/cf/ca/0c/24e266e643be7dfa97e2caf197f31cfa.jpg
Tại Sao Chúng Tôi Muốn Bạn Giàu,"DONALD J.TRUMP, ROBERT T.KIYOSAKI",102000,659,56,5.0,https://salt.tikicdn.com/cache/280x280/ts/product/5d/a2/11/1c601113d26600361332c2e34a1e708e.jpeg
Tâm Thư Của Warren Buffett Dành Cho Con Cái,N/A,137240,196,8,5.0,https://salt.tikicdn.com/cache/280x280/ts/product/20/e4/fb/dd47aa254b4a57faefe94c5c1f0eb5f6.jpg
Sách Bí Mật Tư Duy Triệu Phú,N/A,86400,688,54,5.0,https://salt.tikicdn.com/cache/280x280/ts/product/c4/0d/25/762c13d91cbda79137040f9d7cbbec44.jpg
Chết Vì Chứng Khoán,RICHARDS,144000,1062,181,4.7,https://salt.tikicdn.com/cache/280x280/ts/product/e4/ac/89/e2078da6a0f5c3e93234646cb0e25a00.jpg
Góc Nhìn Alan - Bộ Di Sản Alan Phan,ALAN PHAN,516000,2192,248,4.8,https://salt.tikicdn.com/cache/280x280/ts/product/19/d6/e2/6dc445e282f3f316072cd7f7808e2227.jpg
Sách - Búp sen xanh (sách về Bác Hồ),SƠN TÙNG,72000,17,0,0.0,https://salt.tikicdn.com/cache/280x280/ts/product/1d/d1/47/e257e76678d6daed4b4dd717190d7ac2.jpg
Phương Pháp Quản Trị Mục Tiêu – Triết Lý Kinh Doanh Của Công Ty Tỷ Đô BYTEDANCE,N/A,137240,36,0,0.0,https://salt.tikicdn.com/cache/280x280/ts/product/8f/54/ef/bc5882713b138815003aa4c7b3981609.jpg
Đọc Vị Tâm Lý Hành Vi Của Giới Giàu Và Giới Siêu Giàu,RAINER ZITELMANN,215280,383,25,5.0,https://salt.tikicdn.com/cache/280x280/ts/product/61/dc/c9/c04d8f726700ef0c4578a57b1e18a445.png
"OKR: ""Kinh Thánh"" Quản Trị Và Cách Vận Hành Hiệu Qủa",PIOTR FELIKS GRZYWACZ,82900,104,5,5.0,https://salt.tikicdn.com/cache/280x280/ts/product/c6/f4/f5/a48251c3d645752807ec120349b89c1d.jpg
OJT: Công Cụ Phát Triển Nguồn Nhân Lực Kế Thừa,NAKAO YUSUKE,63100,118,7,5.0,https://salt.tikicdn.com/cache/280x280/ts/product/fb/49/49/da4a4eaf1750361af72e5561887dccd2.jpg
Combo 5 Cuốn: Bộ Công Cụ Xây Dựng Đo Lường Toàn Bộ Các Chỉ Số Của Doanh Nghiệp,NHÓM TÁC GIẢ,416650,27,5,5.0,https://salt.tikicdn.com/cache/280x280/ts/product/e0/33/24/1508eab82cbaa8cd942db58c6e8fa847.jpg
Góc Nhìn Alan - Dành Tặng Doanh Nhân Việt Trong Thế Trận Toàn Cầu,ALAN PHAN,199000,1199,127,4.8,https://salt.tikicdn.com/cache/280x280/ts/product/e0/d6/36/29ef581680b81198a2c02f69a83e7c1d.jpg
"Nghĩ Như Một Tỷ Phú - Mọi Thứ Bạn Cần Biết Về Thành Công, Bất Động Sản Và Cuộc Sống","DONALD J.TRUMP, MEREDITH MCLVER",73900,270,16,5.0,https://salt.tikicdn.com/cache/280x280/ts/product/cd/0f/cf/34018f5edd577bc75505ed5fccf1eefa.jpg
Bill Marriott - Những Quyết Định Lịch Sử Làm Nên Đế Chế Khách Sạn Thành Công Nhất Thế Giới,DALE VAN ATTA,211000,343,51,5.0,https://salt.tikicdn.com/cache/280x280/ts/product/e2/c3/0b/bc22567d3ca1eaca07093c26969277ba.jpg
Lập Kế Hoạch Dòng Tiền Thông Minh,FUTOSHI FUJIKAWA,101400,37,2,5.0,https://salt.tikicdn.com/cache/280x280/ts/product/aa/3d/b8/2c07161d3dfef5e25ff2cd05f0885185.jpg
5 Nguyên Tắc Bất Biến Để Xây Dựng Đội Nhóm Vô Địch,N/A,140160,55,0,0.0,https://salt.tikicdn.com/cache/280x280/ts/product/eb/76/dc/a39ce7f1eff6020779bb7f9743df12c2.jpg
Phát minh & Khám phá - Những bài viết xuất sắc nhất về kinh doanh và cuộc sống của tỉ phú sáng lập,JEFF BEZOS,117000,146,12,4.6,https://salt.tikicdn.com/cache/280x280/ts/product/3e/f8/1a/75d2302324c06144912264724f536917.jpg
Một Phút Với Honda Soichiro,IWAKURA SHINYA,53390,41,2,4.5,https://salt.tikicdn.com/cache/280x280/ts/product/90/72/06/3d25a3fa0993dd91f9ef8031f6cb7624.jpg
Đánh Thức Tiềm Năng Tài Chính,ROBERT T. KIYOSAKI,112000,1630,106,4.8,https://salt.tikicdn.com/cache/280x280/media/catalog/product/6/_/6.u5465.d20171016.t114018.572962.jpg
ĐƯỜNG ĐẾN KHO BÁU - CON ĐƯỜNG DẪN ĐẾN KHO BÁU CỦA BẠN,N/A,143650,13,4,5.0,https://salt.tikicdn.com/cache/280x280/ts/product/bf/c1/15/60814ef7e647cab46d3ac1756b8a9e9a.jpg
D. Trump - Đừng Bao Giờ Bỏ Cuộc (Tái Bản),"MEREDITH MCIVER, DONALD TRUMP",80000,3,0,0.0,https://salt.tikicdn.com/cache/280x280/media/catalog/product/8/9/8934974148227.u4972.d20170427.t163130.862556.jpg
Khởi Nghiệp Trên Xe Lăn - Nguyễn Trung Hậu,N/A,79000,98,5,5.0,https://salt.tikicdn.com/cache/280x280/ts/product/09/99/15/52f068c3922440d0c108364d221456ba.png
Doanh Nghiệp Của Thế Kỷ 21 (Tái Bản 2023),N/A,86000,26,1,5.0,https://salt.tikicdn.com/cache/280x280/ts/product/3d/b0/de/57620d00460eb71408c6e03dd91fdd2b.jpeg
Những kẻ xuất chúng - Tái bản lần thứ 14,N/A,115000,50,15,5.0,https://salt.tikicdn.com/cache/280x280/ts/product/9b/93/cd/2c01e682ac5d26dc83a3b4a0c3b6c269.jpg
Hòn tuyết lăn - Những triết lý sống và đầu tư vượt thời gian của Warren Buffett (tái bản 2024),ALICE SCHROEDER,548000,14,1,5.0,https://salt.tikicdn.com/cache/280x280/ts/product/82/c4/63/abf0d17b4cc8dd6bcc54b38897c4c8fe.jpg
Sách Hành Trình Xây Dựng Thương Hiệu Cá Nhân,N/A,122640,69,3,5.0,https://salt.tikicdn.com/cache/280x280/ts/product/1b/08/24/1585d0d04cdec44737cee2c084193e23.jpg
Bí Quyết Xây Dựng Đội Nhóm Tự Quản Đạt Hiệu Suất Cao,AMANO MASARU,70900,82,3,5.0,https://salt.tikicdn.com/cache/280x280/ts/product/bf/8a/b6/910f14ed50ed682be34fbf50a8803002.jpg
Coaching Salespeople Into Sales Champions - Huấn Luyện Nhân Viên Bán Hàng Trở Thành Nhà Vô Địch Bán Hàng,GEHENNA,290200,3,0,0.0,https://salt.tikicdn.com/cache/280x280/ts/product/82/3c/9f/f712022c3b142036629379778acb5a50.jpg
