ten sach,ten tac gia,gia sach,so luong da ban,so luong binh luan,danh gia trung binh,anh sach
Ông Trăm Tuổi Trèo Qua Cửa Sổ Và Biến Mất (Tái Bản),JONAS JONASSON,171500,162,11,5.0,https://salt.tikicdn.com/cache/280x280/ts/product/5f/62/71/26b6f3e1029bad38317073706098398c.jpg
Ngàn Mặt Trời Rực Rỡ (Tái Bản),KHAILED HOSSEINI,84500,9428,1299,4.8,https://salt.tikicdn.com/cache/280x280/ts/product/d3/7f/75/fac27ade799ac1c2c026f764d94e2c83.jpg
Đất Rừng Phương Nam (Tái Bản 2022),ĐOÀN GIỎI,80350,115,9,5.0,https://salt.tikicdn.com/cache/280x280/ts/product/31/a2/1b/70b1e4fc2b497fec6193aa5ce79b8338.jpg
Cảm Ơn Người Lớn (Bìa Mềm) - Bản Tặng Kèm Thiệp + Phong Bì Thiệp + Bookmark (Số Lượng Có Hạn),NGUYỄN NHẬT ÁNH,99500,163,24,5.0,https://salt.tikicdn.com/cache/280x280/ts/product/c8/46/9a/ddd72dee5c2d4756ce2d13df50121614.jpg
"Có thanh xuân nào không đau đớn, có tuổi trẻ nào không bão giông -  Bản Quyền",N/A,109650,N/A,0,0.0,https://salt.tikicdn.com/cache/280x280/ts/product/3c/37/70/26a3a8a72138e77859074bedf015ef38.jpg
Sưởi Ấm Mặt Trời: Tập 2 Của Cây Cam Ngọt,JOSES MAURO DE VASCONCELOS,112000,598,25,5.0,https://salt.tikicdn.com/cache/280x280/ts/product/b8/41/3c/30ea9e85a0944d7d548b330420333506.jpg
Ngàn Mặt Trời Rực Rỡ (Tái Bản),KHAILED HOSSEINI,84500,9428,1299,4.8,https://salt.tikicdn.com/cache/280x280/ts/product/d3/7f/75/fac27ade799ac1c2c026f764d94e2c83.jpg
"Mùa hè không tên (Nguyễn Nhật Ánh) - Tặng kèm Bookmark, Tranh màu, Sổ note cho cả 2 phiên bản - Tặng thêm ngẫu nhiên 1 trong 2 Lót ly cho Bản bìa cứng",NGUYỄN NHẬT ÁNH,103000,4946,420,5.0,https://salt.tikicdn.com/cache/280x280/ts/product/2b/3d/a2/d6a737be2a6fd3aaf76d804a24e3be40.jpg
Làm Bạn Với Bầu Trời (Bìa Mềm) (Tặng Kèm Khung Ảnh Số Lượng Có Hạn),NGUYỄN NHẬT ÁNH,87900,27976,2161,5.0,https://salt.tikicdn.com/cache/280x280/ts/product/af/a1/4b/92477ec9b6688060b2b5d2022a60d3e6.jpg
Ông Trăm Tuổi Trèo Qua Cửa Sổ Và Biến Mất (Tái Bản),JONAS JONASSON,142000,20725,1457,4.8,https://salt.tikicdn.com/cache/280x280/ts/product/5f/62/71/26b6f3e1029bad38317073706098398c.jpg
Hannibal Trỗi Dậy,THOMAS HARRIS,121500,37,2,5.0,https://salt.tikicdn.com/cache/280x280/ts/product/0e/b0/7c/478d8df5bec1b1d8de1f8df3fb9b3b80.jpg
Ngày Xưa Có Một Chuyện Tình (Tái Bản),NGUYỄN NHẬT ÁNH,113530,186,29,5.0,https://salt.tikicdn.com/cache/280x280/ts/product/84/44/83/8f9d456158aae341ae291509ca030c69.jpg
Người Ai Cập - Quyền Lực & Tình Yêu - Tập 2,MIKA WALTARI,137000,52,3,5.0,https://salt.tikicdn.com/cache/280x280/ts/product/b3/c7/22/9eaaf54e14d4015b4e11ed12ca327fee.jpg
Người Ai Cập - Quyền Lực & Tình Yêu - Tập 1,MIKA WALTARI,164000,N/A,0,0.0,https://salt.tikicdn.com/cache/280x280/ts/product/6a/91/3b/4bd67fa0bd6e8fc5d43a815294fed227.jpg
Combo 2Q: Điều Kỳ Diệu Của Tiệm Tạp Hóa NAMIYA (Tái Bản) + Tiệm Cắt Tóc Lúc Nửa Đêm (Bộ Truyện Hấp Dẫn/Lôi Cuốn),N/A,187500,N/A,0,0.0,https://salt.tikicdn.com/cache/280x280/ts/product/46/b9/e1/569b48a7e16bb00d71fba536980e38cc.png
Ngày Xưa Có Một Chuyện Tình (Tái Bản),NGUYỄN NHẬT ÁNH,93800,5476,963,5.0,https://salt.tikicdn.com/cache/280x280/ts/product/84/44/83/8f9d456158aae341ae291509ca030c69.jpg
Những Kẻ Âu Lo,FREDRIK BACKMAN,138000,764,86,5.0,https://salt.tikicdn.com/cache/280x280/ts/product/8a/af/c9/8973d97deb158e597d1631166f843ab4.jpg
Còn Chút Gì Để Nhớ,NGUYỄN NHẬT ÁNH,82000,322,36,5.0,https://salt.tikicdn.com/cache/280x280/ts/product/71/20/e5/9272c5709a1aa1b5cd062ae9e1b627f4.jpg
"Ra Bờ Suối Ngắm Hoa Kèn Hồng (Truyện Dài-Nguyễn Nhật Ánh)- Bìa Cứng (Màu Trắng)[Tặng Kèm: Bookmark Bồi Hai Mặt, Thiệp Trái Tim In Bài Thơ Của Tác Giả, Đặc Biệt Tặng Kèm Phiên Bản Khổ Nhỏ Tựa Sách Út Quyên Và Tôi (Cùng Tác Giả)]",NGUYỄN NHẬT ÁNH,195000,11500,2093,5.0,https://salt.tikicdn.com/cache/280x280/ts/product/10/4d/00/5bf0cffaae041b64a6db7bcb5a0125e3.jpg
"Ngày mai, ngày mai và ngày mai nữa",GABRIELLE ZEVIN,155400,425,32,5.0,https://salt.tikicdn.com/cache/280x280/ts/product/41/d0/39/489d10a32100c1d290e9f22f397b5301.jpg
Cho Tôi Xin Một Vé Đi Tuổi Thơ,NGUYỄN NHẬT ÁNH,76000,130,14,4.7,https://salt.tikicdn.com/cache/280x280/ts/product/8f/63/5d/e17ddc42fbf8bf15b1958222ed1939dc.jpg
"Ngày mai, ngày mai và ngày mai nữa",GABRIELLE ZEVIN,204970,N/A,0,0.0,https://salt.tikicdn.com/cache/280x280/ts/product/41/d0/39/489d10a32100c1d290e9f22f397b5301.jpg
Mắt Biếc (Tái Bản 2019),NGUYỄN NHẬT ÁNH,99500,514,87,4.8,https://salt.tikicdn.com/cache/280x280/ts/product/e2/77/44/170fa32d7932b634a357b4585333582b.jpg
Beartown 2: Chúng tôi đấu với các bạn,FREDRIK BACKMAN,184000,N/A,0,0.0,https://salt.tikicdn.com/cache/280x280/ts/product/da/0f/ed/1d3ce509fe574c84197a5607df18dd28.jpg
Giết Con Chim Nhại (Tái Bản),HARPER LEE,119500,305,40,4.8,https://salt.tikicdn.com/cache/280x280/ts/product/07/d5/b7/68b4d6773f4d1ecd9fd5869e693c45b1.jpg
Tôi Là Bêtô,NGUYỄN NHẬT ÁNH,71300,11916,1196,4.8,https://salt.tikicdn.com/cache/280x280/ts/product/de/d7/97/b9d7489cc2602bbbd45f23b0af1d8d48.jpg
"Beartown - Thị trấn nhỏ, giấc mơ lớn",FREDRIK BACKMAN,173000,494,40,4.8,https://salt.tikicdn.com/cache/280x280/ts/product/a3/ef/a1/048355239396f0f7f123e7993a0e0066.jpg
Giết Con Chim Nhại (Tái Bản),HARPER LEE,78000,14015,1530,4.8,https://salt.tikicdn.com/cache/280x280/ts/product/f9/43/fe/c0f35edda6a18c65d638e731063b0cc1.jpg
Cho Tôi Xin Một Vé Đi Tuổi Thơ,NGUYỄN NHẬT ÁNH,68100,20872,1677,4.8,https://salt.tikicdn.com/cache/280x280/ts/product/8f/63/5d/e17ddc42fbf8bf15b1958222ed1939dc.jpg
"Một Người Đi Tiếp, Một Người Quẩn Quanh",CHÂU SA ĐÁY MẮT,63400,242,22,5.0,https://salt.tikicdn.com/cache/280x280/ts/product/a8/df/b3/5f2ac9717378bf273d7025966b6baafe.jpg
HEIDI - Cuốn sách dành cho trẻ em và những ai yêu trẻ em -Dịch giả Nguyễn Bích Lan,JOHANNA SPYRI,94400,40,2,5.0,https://salt.tikicdn.com/cache/280x280/ts/product/03/79/1e/100af57fa3319bb93bedac3650d046c4.jpg
Cảm Ơn Người Lớn (Bìa Mềm) - Bản Tặng Kèm Thiệp + Phong Bì Thiệp + Bookmark (Số Lượng Có Hạn),NGUYỄN NHẬT ÁNH,66000,32128,1045,4.8,https://salt.tikicdn.com/cache/280x280/ts/product/c8/46/9a/ddd72dee5c2d4756ce2d13df50121614.jpg
Người Ai Cập - Quyền Lực & Tình Yêu - Tập 1,MIKA WALTARI,138700,70,5,5.0,https://salt.tikicdn.com/cache/280x280/ts/product/6a/91/3b/4bd67fa0bd6e8fc5d43a815294fed227.jpg
Người Ai Cập - Quyền Lực & Tình Yêu - Tập 2,MIKA WALTARI,137000,52,3,5.0,https://salt.tikicdn.com/cache/280x280/ts/product/b3/c7/22/9eaaf54e14d4015b4e11ed12ca327fee.jpg
Mùa Hè Không Tên (Nguyễn Nhật Ánh) - Kèm quà tặng,NGUYỄN NHẬT ÁNH,168000,80,6,5.0,https://salt.tikicdn.com/cache/280x280/ts/product/00/71/c7/ced1eec74251ac6bf41bde8a60e055b9.jpg
Sự Im Lặng Của Bầy Cừu (Tái Bản),THOMAS HARRIS,91900,17954,2717,4.8,https://salt.tikicdn.com/cache/280x280/ts/product/cd/2a/5b/926ca6c7b295c6e7cea39390efe08968.jpg
Những Người Hàng Xóm - Bản Thường - Bìa Mềm (Tặng kèm Bookmark + Thẻ treo),NGUYỄN NHẬT ÁNH,82500,4727,500,5.0,https://salt.tikicdn.com/cache/280x280/ts/product/a2/f0/e7/d7bc5cb5e12fac78066eb630a077ae95.jpg
Dám Hạnh Phúc,"KOGA FUMITAKE, KISHIMI ICHIRO",85900,7134,548,4.8,https://salt.tikicdn.com/cache/280x280/ts/product/47/bf/82/36d16def99eafa5db9b2e3cf2efd0f43.jpg
Beartown 2: Chúng tôi đấu với các bạn,FREDRIK BACKMAN,169000,354,31,5.0,https://salt.tikicdn.com/cache/280x280/ts/product/da/0f/ed/1d3ce509fe574c84197a5607df18dd28.jpg
Hạ Đỏ,NGUYỄN NHẬT ÁNH,71000,352,38,5.0,https://salt.tikicdn.com/cache/280x280/ts/product/de/0c/c4/41f9790f153a6a598ad4d5d68c8e94f3.jpg
Con Chó Nhỏ Mang Giỏ Hoa Hồng (Tái Bản),NGUYỄN NHẬT ÁNH,71300,3337,460,4.8,https://salt.tikicdn.com/cache/280x280/ts/product/2d/ff/93/cf76ac4703f587c3188c5438dfb55af3.jpg
Bồ Câu Không Đưa Thư (Tái Bản),NGUYỄN NHẬT ÁNH,85600,2942,269,5.0,https://salt.tikicdn.com/cache/280x280/ts/product/81/4e/c2/7df40ea68486629e75fb5e0e5c696589.jpg
Công tử mồ côi,FRANCES HODGSON BURNETT,80100,53,3,5.0,https://salt.tikicdn.com/cache/280x280/ts/product/a8/56/ac/02ddc05fff108e38da6484fca02bc16b.jpg
Đất Rừng Phương Nam (Tái Bản 2022),ĐOÀN GIỎI,80350,115,9,5.0,https://salt.tikicdn.com/cache/280x280/ts/product/31/a2/1b/70b1e4fc2b497fec6193aa5ce79b8338.jpg
Trò chơi của kẻ nhắc tuồng,DONATO CARRISI,127000,103,10,5.0,https://salt.tikicdn.com/cache/280x280/ts/product/95/a5/b3/4de4a573c6b3bca97040517801ccaed6.jpg
Hannibal Trỗi Dậy,THOMAS HARRIS,97800,3393,612,4.7,https://salt.tikicdn.com/cache/280x280/ts/product/0e/b0/7c/478d8df5bec1b1d8de1f8df3fb9b3b80.jpg
Totto - Chan Bên Cửa Sổ (Tái Bản),KUROYANAGI TETSUKO,98000,5,1,5.0,https://salt.tikicdn.com/cache/280x280/ts/product/44/a9/b6/d0338c88f2001ed1ebcc71cc02eb20fd.jpg
Harry Potter Và Chiếc Cốc Lửa (Tái Bản 2022),J.K.ROWLING,223000,503,60,5.0,https://salt.tikicdn.com/cache/280x280/ts/product/51/fe/bb/a183571a904a644c4437d138e9f4e3d0.jpg
Mắt Biếc (Tái Bản 2019),NGUYỄN NHẬT ÁNH,90200,34880,2959,4.8,https://salt.tikicdn.com/cache/280x280/ts/product/10/d1/35/b2098bf8884bb8a5fbcd42a978a6b601.jpg
Hảo Nữ Trung Hoa,HÂN NHIÊN,95900,3199,670,5.0,https://salt.tikicdn.com/cache/280x280/ts/product/06/1b/f0/a2ea3eaa729dffc046b6a48af14bd0e2.jpg
Phương Trình Hạ Chí,HIGASHINO KEIGO,128000,3519,218,4.7,https://salt.tikicdn.com/cache/280x280/ts/product/44/ae/28/276338790028da4d0326850a63d73d1a.jpg
Của Chuột Và Người,JOHN STEINBECK,73200,1794,252,4.8,https://salt.tikicdn.com/cache/280x280/ts/product/d0/37/81/e964a484e38e55f48f42a622c4897589.jpg
Sách - Aliss Bên Đám Lửa - Jon Fosse (tác giả Nobel Văn chương 2023) - Rainbow Books,N/A,59250,41,1,5.0,https://salt.tikicdn.com/cache/280x280/ts/product/7b/f9/09/6fa4b8b26b4a55cc0fc0f556fcdaa23b.jpg
Ký Ức Nửa Đêm (Tái Bản),SIDNEY SHELDON,77000,659,49,4.7,https://salt.tikicdn.com/cache/280x280/ts/product/ca/12/f6/64bb4827953c3bc48d455e8c623e20ae.jpg
Hành trình yêu,ALAIN DE BOTTON,127000,141,4,5.0,https://salt.tikicdn.com/cache/280x280/ts/product/c9/8c/cb/9d5dccb9b93ee8641ac5b10eac6f601f.jpg
